{
  "envelope_id": "env.mova_agent_profile_publish_v1",
  "verb": "publish",
  "roles": {
    "publisher": "org:mova-compact",
    "registry": "registry:mova-agent-catalog"
  },
  "agent_profile": {
    "agent_id": "agent.math-proof.v1",
    "agent_version": "1.0.0",
    "status": "active",
    "owner": {
      "owner_id": "org:mova-compact",
      "owner_kind": "organization"
    },
    "task_domains": [
      "math"
    ],
    "runtime_binding_ref": "runtime_core:local_process",
    "policy_profile_ref": "mova_security_default_v1@1.0.0",
    "observability_profile": {
      "compact_required": true,
      "semantic_required": true,
      "otel_correlation_required": true,
      "required_artifacts": [
        "run.compact",
        "run.semantic.jsonl"
      ]
    },
    "determinism_controls": {
      "seed_required": true,
      "replay_supported": true
    }
  },
  "meta": {
    "published_at": "2026-02-18T10:00:00Z"
  }
}
